[
  {
    "candidateId": "PP-C01",
    "slug": "anker-332-usb-c-hub",
    "route": "/products/usb-c-hub/",
    "name": "Anker 332 USB-C Hub (5-in-1)",
    "category": "Ports and connectivity",
    "problem": "A USB-C laptop has too few data ports and needs a verified path to HDMI plus pass-through charging.",
    "verdict": "Selected for a compatibility-first hub page because the A8355 family has a manufacturer specification and exact Amazon Egypt and Noon Egypt product pages. It is useful only after the buyer verifies USB-C video support and supplies a compliant charger and cable.",
    "bestFor": [
      "Editorial fit judgment: USB-C laptop owners who need one HDMI output and three 5Gbps data ports at a fixed desk",
      "Editorial fit judgment: buyers who will check their host port and charging requirements before ordering"
    ],
    "skipIf": [
      "Your laptop USB-C port does not support the required video output",
      "You need a charger in the box or more than 4K at 30Hz from this hub"
    ],
    "brand": "Anker",
    "model": "A8355 / A8355H11",
    "compatibility": [
      "Compatible USB-C host with video output is required for HDMI",
      "HDMI output is listed up to 4K at 30Hz",
      "USB-C PD input is listed up to 100W, with up to 85W passed to the laptop",
      "A charger is not included"
    ],
    "snapshotPriceEgp": 1539,
    "priceCapturedAt": "2026-07-15",
    "primaryKeyword": {
      "evidenceId": "SEO-KW-001",
      "keyword": "usb c hub",
      "intent": "commercial investigation",
      "market": "EG",
      "metricName": "google_autocomplete_presence",
      "metricValue": "returned",
      "metricUnit": "qualitative",
      "sourceUrl": "https://suggestqueries.google.com/complete/search?client=firefox&hl=en&gl=eg&q=usb%20c%20hub",
      "capturedAt": "2026-07-14T23:52:11Z"
    },
    "supportingKeywords": [
      "usb c hub egypt",
      "usb c hub for laptop",
      "موزع يو اس بي تايب سي",
      "هاب type c"
    ],
    "score": {
      "components": {
        "problemUrgency": 23,
        "searchIntent": 18,
        "availability": 15,
        "value": 12,
        "compatibility": 9,
        "editorialFit": 9,
        "visual": 4
      },
      "total": 90
    },
    "providers": [
      {
        "retailer": "Amazon Egypt",
        "directUrl": "https://www.amazon.eg/-/en/dp/B0BQLLB61B",
        "affiliateUrl": null,
        "affiliateStatus": "DIRECT_LINK — AFFILIATE ID REQUIRED",
        "listingTitle": "Anker 332 USB-C Hub (5-in-1)",
        "sellerNotes": "Observed in stock at EGP 1,539; Amazon.eg was seller and shipper, with free returns and 15-day returnability. Recheck all offer details before promotion.",
        "priceEgp": 1539,
        "capturedAt": "2026-07-15",
        "imageSourceUrl": "https://www.amazon.eg/-/en/dp/B0BQLLB61B",
        "imageRights": "SOURCE_LINK_ONLY"
      },
      {
        "retailer": "Noon Egypt",
        "directUrl": "https://www.noon.com/egypt-en/anker-332-usb-c-hub-5-in-1-usb-c-connector-with-4k-hdmi-100w-power-charger-black-a8355h11/N70086896V/p/",
        "affiliateUrl": null,
        "affiliateStatus": "DIRECT_LINK — AFFILIATE ID REQUIRED",
        "listingTitle": "Anker 332 USB-C Hub A8355H11",
        "sellerNotes": "Observed at EGP 1,999 with five units left, sold by Dokkan Tech and fulfilled with noon-express. Recheck all offer details before promotion.",
        "priceEgp": 1999,
        "capturedAt": "2026-07-14",
        "imageSourceUrl": "https://www.noon.com/egypt-en/anker-332-usb-c-hub-5-in-1-usb-c-connector-with-4k-hdmi-100w-power-charger-black-a8355h11/N70086896V/p/",
        "imageRights": "SOURCE_LINK_ONLY"
      }
    ],
    "evidence": [
      {
        "evidenceId": "PP-E001",
        "claim": "Manufacturer specification: model A8355 lists HDMI up to 4K at 30Hz, three 5Gbps data ports, 100W PD input, and up to 85W laptop output.",
        "sourceUrl": "https://www.anker.com/products/a8355",
        "capturedAt": "2026-07-14T23:54:02Z"
      },
      {
        "evidenceId": "PP-E027",
        "claim": "Amazon Egypt price, stock, seller, fulfillment, returns, and exact-family listing snapshot.",
        "sourceUrl": "https://www.amazon.eg/-/en/dp/B0BQLLB61B",
        "capturedAt": "2026-07-15T00:20:00Z"
      },
      {
        "evidenceId": "PP-E002",
        "claim": "Noon Egypt price, stock, seller, fulfillment, and exact A8355H11 listing snapshot.",
        "sourceUrl": "https://www.noon.com/egypt-en/anker-332-usb-c-hub-5-in-1-usb-c-connector-with-4k-hdmi-100w-power-charger-black-a8355h11/N70086896V/p/",
        "capturedAt": "2026-07-14T23:54:02Z"
      },
      {
        "evidenceId": "PP-E028",
        "claim": "Power and safety gate: charger is not included; use a compliant PD charger and cable and verify host video support.",
        "sourceUrl": "https://www.anker.com/products/a8355",
        "capturedAt": "2026-07-15T00:20:00Z"
      }
    ],
    "risks": [
      "A USB-C connector alone does not prove that the host supports the required video output.",
      "Retail prices, stock, seller, fulfillment, and returns are dated snapshots and require a launch-day recheck.",
      "Noon Egypt affiliate commission eligibility is unconfirmed because current public terms name UAE and KSA, not Egypt."
    ],
    "closestRejectedAlternative": "Baseus UltraJoy BS-OH150 lost because no verified Amazon Egypt exact-model product page was found, leaving single-retailer dependence."
  },
  {
    "candidateId": "PP-C04",
    "slug": "ugreen-40289-laptop-stand",
    "route": "/products/laptop-stand/",
    "name": "UGREEN Foldable Laptop Stand 40289",
    "category": "Posture and desk positioning",
    "problem": "A laptop screen sits too low for a desk workflow and needs adjustable elevation without hiding the base ventilation area.",
    "verdict": "Selected as a simple elevation tool with an exact model trail across the manufacturer, Amazon Egypt, and Noon Egypt. Raising the laptop does not by itself create an ergonomic workstation; an external keyboard and mouse are the practical fit gate.",
    "bestFor": [
      "Editorial fit judgment: desk users who already have or plan to use an external keyboard and mouse",
      "Editorial fit judgment: users who want a foldable stand with five listed height settings"
    ],
    "skipIf": [
      "You must keep using the laptop keyboard while the screen is raised",
      "Your device is outside the listed 8–17.3-inch range or exceeds the listed 5 kg load"
    ],
    "brand": "UGREEN",
    "model": "LP451 / 40289",
    "compatibility": [
      "Manufacturer lists 8–17.3-inch laptop compatibility",
      "Manufacturer lists five height settings and up to 5 kg load",
      "The open center is described as a ventilation area",
      "Use an external keyboard and mouse when the raised keyboard is not comfortable to reach"
    ],
    "snapshotPriceEgp": 666,
    "priceCapturedAt": "2026-07-15",
    "primaryKeyword": {
      "evidenceId": "SEO-KW-007",
      "keyword": "laptop stand",
      "intent": "commercial investigation",
      "market": "EG",
      "metricName": "google_autocomplete_presence",
      "metricValue": "returned",
      "metricUnit": "qualitative",
      "sourceUrl": "https://suggestqueries.google.com/complete/search?client=firefox&hl=en&gl=eg&q=laptop%20stand",
      "capturedAt": "2026-07-14T23:52:11Z"
    },
    "supportingKeywords": [
      "laptop stand egypt",
      "laptop stand for desk",
      "حامل لابتوب",
      "حامل لابتوب قابل للطي",
      "ستاند لابتوب"
    ],
    "score": {
      "components": {
        "problemUrgency": 18,
        "searchIntent": 18,
        "availability": 15,
        "value": 14,
        "compatibility": 10,
        "editorialFit": 9,
        "visual": 5
      },
      "total": 89
    },
    "providers": [
      {
        "retailer": "Amazon Egypt",
        "directUrl": "https://www.amazon.eg/-/en/dp/B08TLVKBMJ",
        "affiliateUrl": null,
        "affiliateStatus": "DIRECT_LINK — AFFILIATE ID REQUIRED",
        "listingTitle": "UGREEN Foldable Laptop Stand",
        "sellerNotes": "Observed in stock at EGP 666; Amazon.eg was seller and shipper, with free returns. Recheck before promotion.",
        "priceEgp": 666,
        "capturedAt": "2026-07-15",
        "imageSourceUrl": "https://www.amazon.eg/-/en/dp/B08TLVKBMJ",
        "imageRights": "SOURCE_LINK_ONLY"
      },
      {
        "retailer": "Noon Egypt",
        "directUrl": "https://www.noon.com/egypt-en/laptop-stand-aluminum-alloy-adjustable-eye-level-ergonomic-height-laptop-riser-holder-compatible-for-macbook-pro-2021-air-chromebook-and-more-storage-bag-included/N53340883A/p/",
        "affiliateUrl": null,
        "affiliateStatus": "DIRECT_LINK — AFFILIATE ID REQUIRED",
        "listingTitle": "UGREEN Laptop Stand 40289",
        "sellerNotes": "Observed at EGP 945.60 with add-to-cart availability, sold by wusool and fulfilled with noon-express. No numeric stock count was exposed; recheck before promotion.",
        "priceEgp": 945.6,
        "capturedAt": "2026-07-14",
        "imageSourceUrl": "https://www.noon.com/egypt-en/laptop-stand-aluminum-alloy-adjustable-eye-level-ergonomic-height-laptop-riser-holder-compatible-for-macbook-pro-2021-air-chromebook-and-more-storage-bag-included/N53340883A/p/",
        "imageRights": "SOURCE_LINK_ONLY"
      }
    ],
    "evidence": [
      {
        "evidenceId": "PP-E007",
        "claim": "Manufacturer specification: model 40289 lists 8–17.3-inch fit, five height settings, up to 5 kg load, foldability, and an open ventilation area.",
        "sourceUrl": "https://www.ugreen.com/tr-tr/products/tr-40289",
        "capturedAt": "2026-07-14T23:54:02Z"
      },
      {
        "evidenceId": "PP-E029",
        "claim": "Amazon Egypt exact-product price, stock, seller, fulfillment, and returns snapshot.",
        "sourceUrl": "https://www.amazon.eg/-/en/dp/B08TLVKBMJ",
        "capturedAt": "2026-07-15T00:22:00Z"
      },